Name,Address
Florinda Collective,"Calle Trajano, 11,"
La Gorda del Arenal,"C. Adriano, 5,"
Taberna La Botica: Una experiencia gastronómica sin gluten en Sevilla,"Av. de las Ciencias, 21, 41020 Sevilla"
Hamburguesas sin gluten: Atípico Sevilla Este,"Mercado de abastos, Av. del deporte, local 13."
Hamburguesería sin gluten en Sevilla: Atípico Pino Montano.,"Calle Mar Mediterráneo, 5 (local 7)"
Hamburguesas gourmet sin gluten: Atípico Triana.,"Calle virtud, 2"
Cervezas Gran Vía: Auténtica cerveza sin gluten en Sevilla,Teléfono  643 15 27 94
Dulcería La Rondeña,La Dulcería de La Rondeña
Pizzería La Roma: Tradición artesanal y opción 100% sin gluten en Sevilla,Sevilla – Los Remedios
Edamame,"C/ Diego de la Barrera, local C"
"MITO, Asunción","C. Asunción, 9."
Jaleo Gastrobar,"Av. de Alemania, 3."
Gloria y Rositas,"C. Zaragoza, 16, Casco Antiguo."
Muelle 21,"Av. Santiago Montoto, s/n"
El Cabildo,"Pl. del Cabildo, 0, Casco Antiguo."
Restaurante El 29,"Av. Isabel la Católica, Parque De Maria Luisa, 2."
Abades Triana,"C. Betis, 69"
Tablao Flamenco La Cantaora,"C. Albareda, 22, Casco Antiguo"
Chök. Sagasta,"C. Sagasta, 20"
La Tarta de la Madre de Cris. Álvarez Quintero,"C/ Álvarez Quintero, 2. Casco Antiguo"
La Tarta de la Madre de Cris. Triana,"C/ Callao, 7"
Atávico,"Av. de la Borbolla, 3"
Cerveza Guadalquibeer,T. 678 49 87 87
Panino&Piú,"Calle Baños, 51, B"
Nachos y Papas,"Alameda de Hércules, 21, bajo."
"MITO, Álvarez Quintero","Estamos en pleno corazón de Sevilla, al lado de la Iglesia del Salvador concretamente."
Jaleo tapas,Mercado de Feria. Pl. Calderón de la Barca
Queen’s Bakery,"C/ Presidente Cárdenas, 10. 41013 Sevilla"
"Mehl, Bermejales","Av. de Alemania, 20"
"Mehl, Alameda","Calle Joaquín Costa, 10 A"
Restaurante Jábega,"Avenida Kansas City, 92. 41007 Sevilla."
Grosso Napoletano,"Calle Alameda de Hércules, 46. 41002, Sevilla."
"Mito, San Pablo","Estamos en pleno corazón de Sevilla, en el Arco del Postigo concretamente."
Despacho de Caracoles Sevilla Este,"Plaza de la Malagueta, local 13 A. 41020 Sevilla"
Mito. Postigo,"Estamos en pleno corazón de Sevilla, en el Arco del Postigo concretamente."
Petit Comité,"C/Dos de Mayo, 30"
Freiduría Bahía,"C. Génova, 2,"
Orfeo,"Jesús del Gran Poder, 19, 41002 Sevilla, T. 678 14 04 66"
La Monella,"Avenida Alcalde Luis Uruñuela. Edificio Congreso, local 18, Sevilla"
"Trafus, al plato puesto","Divino Redentor, 11"
La Chaparrita,"C/ Grupo Oscar Carvallo, 5"
Flor de Sal,"Calle Espinosa y Cárcel, 10."
Ananás Coffee & Brunch,C/ Pirineos 3
Isla Mágica,"Pabellón de España, s/n"
Queen’s Coffee,"C/ Rafael Alberti, 10"
Restaurante Azahar,"Plaza Jesús de La Redención,2"
El Pasaje de Santa María La Blanca,"C/ Ximénez de Enciso, 33"
Durazno & Chajá,"C/ Asunción, 59"
"Gioelia Cremeria, Reyes Católicos","Calle Reyes Católicos, 19"
Restaurante De la O,"Calle Nuestra Señora de la O, 29. Junto al hotel Ribera de Triana."
Freiduría Poseidón,"Av. de Kansas City, 96"
Pura fruta,Calle Pérez Galdós 34.
Estragón,"Avda. Felipe II, Esq. Progreso, 20"
Barrabaja,"Calle Javier Lasso de la Vega, 14"
La Tizná,"Calle Camilo José Cela, 1"
Taberna la oficina,"Plaza Amoríos, 1"
Bistro Los Tulipanes,"Almirante Ulloa, 8"
Mister Noodles,"Av. San Francisco Javier, 4"
Postigo 10,"C/ Almirantazgo número 10, junto al arco del Postigo"
Al Solito Posto,"Alameda de Hércules, 16"
Habanita,
